{
  "id": "interior_table_set",
  "label": "Table et chaises",
  "theme": "generic",
  "tags": ["interior", "furniture"],
  "footprint": { "w": 3, "h": 3 },
  "anchor": "center",
  "constraints": { "needsClearArea": true },
  "elements": [
    { "type": "obstacle", "typeId": "table-wood", "x": 1, "y": 1, "variant": "base", "rotation": 0 },
    { "type": "obstacle", "typeId": "chair-wood", "x": 1, "y": 0, "variant": "base", "rotation": 180 },
    { "type": "obstacle", "typeId": "chair-wood", "x": 1, "y": 2, "variant": "base", "rotation": 0 },
    { "type": "obstacle", "typeId": "chair-wood", "x": 0, "y": 1, "variant": "base", "rotation": 90 },
    { "type": "obstacle", "typeId": "chair-wood", "x": 2, "y": 1, "variant": "base", "rotation": 270 }
  ]
}
