{
  "id": "forest_grove_3x3",
  "label": "Petit bosquet",
  "theme": "forest",
  "tags": ["grove", "trees"],
  "footprint": { "w": 3, "h": 3 },
  "anchor": "center",
  "constraints": { "needsClearArea": true },
  "elements": [
    { "type": "obstacle", "typeId": "tree-oak", "x": 0, "y": 0, "variant": "base", "rotation": 0 },
    { "type": "obstacle", "typeId": "tree-oak", "x": 2, "y": 0, "variant": "base", "rotation": 0 },
    { "type": "obstacle", "typeId": "tree-oak", "x": 0, "y": 2, "variant": "base", "rotation": 0 },
    { "type": "obstacle", "typeId": "tree-oak", "x": 2, "y": 2, "variant": "base", "rotation": 0 },
    { "type": "obstacle", "typeId": "bush", "x": 1, "y": 1, "variant": "base", "rotation": 0 }
  ]
}
