{
  "id": "interior_tavern_corner",
  "label": "Coin taverne",
  "theme": "generic",
  "tags": ["interior", "tavern", "furniture"],
  "footprint": { "w": 4, "h": 4 },
  "anchor": "bottomLeft",
  "constraints": { "needsClearArea": true },
  "elements": [
    { "type": "obstacle", "typeId": "table-wood", "x": 1, "y": 1, "variant": "base", "rotation": 0 },
    { "type": "obstacle", "typeId": "chair-wood", "x": 1, "y": 0, "variant": "base", "rotation": 180 },
    { "type": "obstacle", "typeId": "chair-wood", "x": 2, "y": 1, "variant": "base", "rotation": 270 },
    { "type": "obstacle", "typeId": "barrel-wood", "x": 3, "y": 0, "variant": "base", "rotation": 0 },
    { "type": "obstacle", "typeId": "crate-wood", "x": 3, "y": 1, "variant": "base", "rotation": 0 }
  ]
}
